<Message xmlns:xsi="http://www.w3.org/2001/XMLSchema-instance"
                 xsi:noNamespaceSchemaLocation="airline.xsd">
	<GUFI>DBCde3hij1</GUFI> <!-- Identifier: 10-character alphanumeric identifier done  TODO: This can't start with a number.  Is that fine? -->
	<sourceAirport>BWI</sourceAirport> <!-- done -->
	<destinationAirport>ORD</destinationAirport> <!-- 3 Letter Airport Code done -->
	<departureTime>2014-06-21T13:25:00Z</departureTime>  <!-- Zulu Time in UTC/GMT - Ex: 2014-06-21T13:25:00Z done -->
	<arrivalTime>2014-06-21T17:33:00Z</arrivalTime> <!-- done -->
	<aircraftType>CC32</aircraftType> <!-- String of 2-4 characters identifying the type of aircraft.  Single letter followed by 1-3 letters or digits done -->
	<aircraftAddress>01020F</aircraftAddress>  <!-- 6 hex digits done -->
	<aircraftSize></aircraftSize> <!-- could be H, J or empty.  H is for Heavy.  J is for Jumbo done -->
	<altitude>33</altitude> <!-- Represents an altitude in hundreds of feet.  Consists of a string with 2-3 digits done -->
	<beaconCode>FFFF</beaconCode> <!-- Four-digit string representation of an octal number, or the value "FFFF" done -->
	<comments>1234567890123456789012345678901234567890123456789012345678901234567890123456789012345678901234567890123456789012345678901234567890123456789012345678901234567890123456789012345678901234567890123456789012345  67890123456789012345dadfsadfdsaf1234567890123456789012345678901234567890123456789012345678901234567890123456789012345  67890123456789012345678901234567890123456789012345678901234567890123456789012345678901  2345678901234567890123456789012345678901234567890123456789012456789012345678901234567890123456789012345678901234567890123456789012345678901234567890123456789012345678901234   567890123456789012345678901234567890123456789012345678901234567890123456789012345678901234567890123456789012345678901234567890123456789012345678901234567890123456789012345678901234567890123456789012345678901234567890123456789012345678901234567890123456789012345678901234567890123456789012345678901234567890123456789012345678901234567890123456789012345678901234567890123456789012345  67890123456789012345678901234567890123456789012345678901234567890123456789012345678901  23456789012345678901234567890123456789012345678901234567890123456789012345678901234567890123456789012345678901234567890123456789012345678901234567890123456789012345678901234   567890123456789012345678901234567890123456789012345678901234567890123456789012345678901234567890123456789012345678901234567890123456789012345678901234567890123456789012345678901234567890123456789012345678901234567890123456789012345678901234567890123456789012345678901234567890123456789012345678901234567890123456789012345678901234567890123456789012345678901234567890123456789012345  67890123456789012345678901234567890123456789012345678901234567890123456789012345678901  23456789012345678901234567890123456789012345678901234567890123456789012345678901234567890123456789012345678901234567890123456789012345678901234567890123456789012345678901234   567890123456789012345678901234567890123456789012345678          90123467890123456789012345678901234567890123456789012345678901234567890123456789012345678901234567890123456789023456789012345678901234567890123456789012345678901234567890123456789012345678901234567890123456789012345678001234567890123456789012345678901234567890123456789012345678901234   56789012345678901234567890123456789012345678901234567890123456789012345678901234567890123456789012345678901234567890123456789012345678901234567890123456789012345678901234567890123456789 dafadsfsadi1230 u-fdsaufsadfafsdeawrewarewar 111d3d</comments> <!-- Free form text between 1 and 3000 alphanumeric plus spaces done -->
	<latitude>4620N</latitude> <!-- 4 digit latitude (degrees minutes) plus optional N or S done -->
	<longitude>7805W</longitude> <!-- 5 digit longitude (degrees minutes) plus optional E or W done.  TODO: Example doesn't make sense! -->
	<personOnBoard>1</personOnBoard> <!-- Number of persons on board; between 1 and 999 done -->
	<segment>/ + * . overcast 0 1 3213</segment> <!-- A string of max length 1000 containing a valid protected segment. Valid characters are any letter or digit, plus '/', '+', '*', '.', ' ', and the overcast symbol. -->
	<category>H</category> <!-- A value indicating the wake tubulence category of an aircraft.  Can be (L or M or H or J) done -->
</Message>